{
  "decision": "accept",
  "rationale": "Политика буфера и стриминг — прямо в зоне ProcessKit-rs (\"стриминг, limits\" из карточки). Предложение аддитивное и обратно совместимое: новый вариант DropOldest + опт-ин метод Command::buffer_policy(...), существующие сигнатуры не меняются, дефолт сохраняется. Затрагивается публичный API Command, но изменение низкорисковое (только расширение) — это accept, а не escalate.",
  "reply_md": "Принято как предложение — берём в работу. Политика буфера и стриминг входят в зону `ProcessKit-rs`, а предложенный вариант аддитивен и обратно совместим.\n\nПлан:\n- Добавить вариант `DropOldest` в буфер (`src/buffer.rs`).\n- Выставить выбор политики на билдере `Command::buffer_policy(...)` (`src/command.rs`); дефолт не меняем.\n- Тесты обеих политик, обновить `CHANGELOG.md` и `docs/streaming.md`.\n\nДекомпозицию приложим задачей. Отдельно отметим пару паритета `ProcessKit` (.NET).",
  "seed": {
    "title": "ProcessKit-rs: политика буфера DropOldest на Command (backward-compatible, opt-in)",
    "repos": ["ProcessKit-rs"],
    "priority": "P2",
    "sketch": "Добавить enum-вариант DropOldest в буфер (src/buffer.rs), выставить через Command::buffer_policy(...) (src/command.rs) опт-ин, дефолт без изменений; тесты обоих режимов; CHANGELOG.md + docs/streaming.md. Command — публичный API (потребители: vcs-toolkit-rs, vcs-flow-rs, agent-workspace), изменение аддитивное. Follow-up: паритет ProcessKit (.NET)."
  }
}
